Product Code,Name,Description,Main,Price,Brand,Category Code,Supplier Product Code,Bar Code
KEYC-C2-B2,Keychron C2-B2 Full Size Layout 104 Key  - Blue Switch RGB - Wired Keyboard,Keychron C2-B2 Full Size Layout 104 Key  - Blue Switch RGB - Wired Keyboard,0,96.1,Keychron,KEYBOARDS - Gaming,C2-B2,4897115556326
KEYC-C2-B3,Keychron C2-B3 Full Size Layout 104 Key  - Brown Switch RGB - Wired Keyboard,Keychron C2-B3 Full Size Layout 104 Key  - Brown Switch RGB - Wired Keyboard,0,96.1,Keychron,KEYBOARDS - Gaming,C2-B3,4897115556333
KEYC-C2-K1Z,Keychron C2-K1Z Full Size Layout 104 Key  Retro Color Red Switch Non-backlight - Wired Keyboard,Keychron C2-K1Z Full Size Layout 104 Key  Retro Color Red Switch Non-backlight - Wired Keyboard,0,86.1,Keychron,KEYBOARDS - Keypad,C2-K1Z,"4895248808541,X0031QIT5J"
KEYC-C2-K2Z,Keychron C2-K2Z Full Size Layout 104 Key  Retro Color Blue Switch Non-backlight - Wired Keyboard,Keychron C2-K2Z Full Size Layout 104 Key  Retro Color Blue Switch Non-backlight - Wired Keyboard,0,86.1,Keychron,KEYBOARDS - Keypad,C2-K2Z,"4895248808558,X0031QJX5J"
KEYC-C2-K3Z,Keychron C2-K3Z Full Size Layout 104 Key  Retro Color Brown Switch Non-backlight - Wired Keyboard,Keychron C2-K3Z Full Size Layout 104 Key  Retro Color Brown Switch Non-backlight - Wired Keyboard,0,86.1,Keychron,KEYBOARDS - Keypad,C2-K3Z,"4895248808565,X0031QOTWV"
KEYC-C2P-B1,Keychron C2 Pro B1 Mechanical Keyboards RGB Backlight Red Switch,Keychron C2 Pro B1 Mechanical Keyboards RGB Backlight Red Switch,0,111.44,Keychron,KEYBOARDS - Wireless,C2P-B1,"4895248836179,X003H60NPR"
KEYC-CAB-1,Keychron Coiled Aviator Cable-Straight Purple,Keychron Coiled Aviator Cable-Straight Purple,0,42.21,Keychron,CABLES,CAB-1,"4895248821700,X00388I8S3"
KEYC-CAB-14,Keychron Coiled Type-C Cable-Straight Pink Orange,Keychron Coiled Type-C Cable-Straight Pink Orange,0,28.08,Keychron,CABLES,CAB-14,"4895248853589,X003UQEO95"
KEYC-CAB-15,Keychron Coiled Type-C Cable-Straight Light Pink,Keychron Coiled Type-C Cable-Straight Light Pink,0,28.08,Keychron,CABLES,CAB-15,"4895248853596,X003UQ6P1P"
KEYC-CAB-16,Keychron Coiled Type-C Cable-Straight Yellow,Keychron Coiled Type-C Cable-Straight Yellow,5,28.08,Keychron,CABLES,CAB-16,"4895248853602,X003UQ82O3"
KEYC-CAB-17,Keychron Coiled Type-C Cable-Straight Light Purple,Keychron Coiled Type-C Cable-Straight Light Purple,3,28.08,Keychron,CABLES,CAB-17,"4895248853619,X003UQ80S1"
KEYC-CAB-18,Keychron Coiled Type-C Cable-Straight Mint,Keychron Coiled Type-C Cable-Straight Mint,0,28.08,Keychron,CABLES,CAB-18,"4895248853626,X003UQEO9F"
KEYC-CAB-19,Keychron Coiled Type-C Cable-Straight Light Blue,Keychron Coiled Type-C Cable-Straight Light Blue,4,28.08,Keychron,CABLES,CAB-19,"4895248853633,X003UQ6P1Z"
KEYC-CAB-2,Keychron Coiled Aviator Cable-Straight Red,Keychron Coiled Aviator Cable-Straight Red,1,42.21,Keychron,CABLES,CAB-2,"4895248821717,X00388CTND"
KEYC-CAB-3,Keychron Coiled Aviator Cable-Angled Purple,Keychron Coiled Aviator Cable-Angled Purple,0,42.21,Keychron,CABLES,CAB-3,"4895248822028,X0038S8F81"
KEYC-CAB-4,Keychron Coiled Aviator Cable-Angled Red,Keychron Coiled Aviator Cable-Angled Red,5,42.21,Keychron,CABLES,CAB-4,"4895248822035,X0038S8IXD"
KEYC-CAB-5,Keychron Coiled Aviator Cable-Straight Rainbow Palted black,Keychron Coiled Aviator Cable-Straight Rainbow Palted black,0,56.25,Keychron,CABLES,CAB-5,"4895248825548,X0039YON2V"
KEYC-CAB-6,Keychron Coiled Aviator Cable-Straight Rainbow Palted blue,Keychron Coiled Aviator Cable-Straight Rainbow Palted blue,2,56.25,Keychron,CABLES,CAB-6,"4895248825555,X003A1IGLR"
KEYC-CAB-7,Keychron Coiled Aviator Cable-Angled Rainbow Palted black,Keychron Coiled Aviator Cable-Angled Rainbow Palted black,0,56.25,Keychron,CABLES,CAB-7,"4895248825562,X0039YOCY5"
KEYC-CAB-8,Keychron Coiled Aviator Cable-Angled Rainbow Palted blue,Keychron Coiled Aviator Cable-Angled Rainbow Palted blue,0,56.25,Keychron,CABLES,CAB-8,"4895248825579,X0039YJ5PV"
KEYC-CAB-9,Keychron Coiled Type-C Cable-Angled White,Keychron Coiled Type-C Cable-Angled White,0,28.08,Keychron,CABLES,CAB-9,"4895248851011,X003TU2AR5"
KEYC-CAB-B,Keychron Coiled Type-C Cable  Black,Keychron Coiled Type-C Cable  Black,0,30.5,Keychron,CABLES,CAB-B,"4895248813217,X00388H8GB"
KEYC-CAB-G,Keychron Coiled Type-C Cable  Grey,Keychron Coiled Type-C Cable  Grey,0,30.5,Keychron,CABLES,CAB-G,"4895248813231,X00388K1LF"
KEYC-CAB-L,Keychron Coiled Type-C Cable Blue,Keychron Coiled Type-C Cable Blue,20,30.5,Keychron,CABLES,CAB-L,"4895248813248,X00388LDFD,4897115554520"
KEYC-CAB-W,Keychron Coiled Type-C Cable-Straight White,Keychron Coiled Type-C Cable-Straight White,0,28.08,Keychron,CABLES,CAB-W,"4895248813224,X00388JZX5"
KEYC-CC-19,Keychron Keyboard Carrying Case K3 / K3 Pro / K3 Max / S1,Keychron Keyboard Carrying Case K3 / K3 Pro / K3 Max / S1,1,51.97,Keychron,ACCESSORIES,CC-19,
KEYC-G1,Keychron K Pro Switch - Red (110 pcs) ,Keychron K Pro Switch - Red (110 pcs) ,0,28.08,Keychron,KEYBOARDS - Keypad,G1,"4895248821908,X0038H4QFD"
KEYC-G11,Keychron Gateron G Pro Switch - Red (110 pcs),Keychron Gateron G Pro Switch - Red (110 pcs),0,35.19,Keychron,KEYBOARDS - Keypad,G11,"4895248826439,X0039YRTA9"
KEYC-G12,Keychron Gateron G Pro Switch - Blue (110 pcs),Keychron Gateron G Pro Switch - Blue (110 pcs),0,35.19,Keychron,KEYBOARDS - Keypad,KEYC-G12,"4895248826446,X0039YJ9DT"
KEYC-G124,Keychron Kailh Jellyfish Box Switch Y(Linear),Keychron Kailh Jellyfish Box Switch Y(Linear),6,96.62,Keychron,ACCESSORIES,KEYC-G124,"4895248833253,X003EWTMJH"
KEYC-G125,Keychron Kailh Jellyfish Box Switch X (Clicky),Keychron Kailh Jellyfish Box Switch X (Clicky),6,96.62,Keychron,ACCESSORIES,KEYC-G125,"4895248833260,X003EW4W6P"
KEYC-G13,Keychron Gateron G Pro Switch - Brown (110 pcs),Keychron Gateron G Pro Switch - Brown (110 pcs),0,35.19,Keychron,KEYBOARDS - Keypad,G13,"4895248826453,X003A0BKXT"
KEYC-G14,Keychron Gateron G Pro Switch - Yellow (110 pcs),Keychron Gateron G Pro Switch - Yellow (110 pcs),0,35.19,Keychron,KEYBOARDS - Keypad,G14,"4895248826460,X0039YRTAJ"
KEYC-G148,Keychron K Pro Switch - Banana (110 pcs),Keychron K Pro Switch - Banana (110 pcs),0,28.08,Keychron,KEYBOARDS - Keypad,G148,"4895248833499,X003EWTMJR"
KEYC-G149,Keychron K Pro Switch - Mint (110 pcs),Keychron K Pro Switch - Mint (110 pcs),0,28.08,Keychron,KEYBOARDS - Keypad,G149,"4895248833505,X003EWTMKB"
KEYC-G16,Keychron Gateron G Pro Switch - Black (110 pcs),Keychron Gateron G Pro Switch - Black (110 pcs),0,35.19,Keychron,KEYBOARDS - Keypad,G16,"4895248826484,X0039YOUXD"
KEYC-G17,Keychron Gateron G Pro Switch - White Two-Stage Spring (110 pcs),Keychron Gateron G Pro Switch - White Two-Stage Spring (110 pcs),2,49.23,Keychron,KEYBOARDS - Keypad,G17,"4895248826491,X0039YOQ73"
KEYC-G18,Keychron Gateron G Pro Switch - Silver Two-Stage Spring (110 pcs),Keychron Gateron G Pro Switch - Silver Two-Stage Spring (110 pcs),1,49.23,Keychron,KEYBOARDS - Keypad,G18,"4895248826507,X003A1KEBH"
KEYC-G199,Keychron Cherry MX2A Switch Set RGB Red,Keychron Cherry MX2A Switch Set RGB Red,6,74.29,Keychron,ACCESSORIES,KEYC-G199,4895248860655
KEYC-G2,Keychron K Pro Switch - Blue (110 pcs),Keychron K Pro Switch - Blue (110 pcs),1,28.08,Keychron,KEYBOARDS - Keypad,G2,"4895248821915,X0038GT1NB"
KEYC-G200,Keychron Cherry MX2A Switch Set RGB Blue,Keychron Cherry MX2A Switch Set RGB Blue,6,74.29,Keychron,ACCESSORIES,KEYC-G200,4895248860662
KEYC-G201,Keychron Cherry MX2A Switch Set RGB Brown,Keychron Cherry MX2A Switch Set RGB Brown,6,74.29,Keychron,ACCESSORIES,KEYC-G201,4895248860679
KEYC-G202,Keychron Cherry MX2A Switch Set RGB Black,Keychron Cherry MX2A Switch Set RGB Black,6,74.29,Keychron,ACCESSORIES,KEYC-G202,4895248860686
KEYC-G203,Keychron Cherry MX2A Switch Set RGB Speed Silver,Keychron Cherry MX2A Switch Set RGB Speed Silver,5,74.29,Keychron,ACCESSORIES,KEYC-G203,4895248860693
KEYC-G204,Keychron Cherry MX2A Switch Set Silent RGB Red,Keychron Cherry MX2A Switch Set Silent RGB Red,3,96.62,Keychron,ACCESSORIES,KEYC-G204,4895248860709
KEYC-G3,Keychron K Pro Switch - Brown (110 pcs),Keychron K Pro Switch - Brown (110 pcs),0,28.08,Keychron,KEYBOARDS - Keypad,G3,"4895248821922,X0038GXTS9"
KEYC-G4,Keychron K Pro Switch - Yellow (110 pcs),Keychron K Pro Switch - Yellow (110 pcs),0,28.08,Keychron,KEYBOARDS - Keypad,G4,"4895248821939,X0038H4QFN"
KEYC-G5,Keychron K Pro Switch - Silver (110 pcs),Keychron K Pro Switch - Silver (110 pcs),0,28.08,Keychron,KEYBOARDS - Keypad,KEYC-G5,"4895248821946,X0038GXTSJ"
KEYC-G6,Keychron Silent K Pro Switch - Red (110 pcs),Keychron Silent K Pro Switch - Red (110 pcs),0,42.21,Keychron,KEYBOARDS - Keypad,G6,"4895248821953,X0038GR1WT"
KEYC-G69,Keychron Cherry Switch - Red (110 pcs),Keychron Cherry Switch - Red (110 pcs),1,63.36,Keychron,KEYBOARDS - Keypad,G69,"4895248827016,X0039YLJNR"
KEYC-G70,Keychron Cherry Switch - Blue (110 pcs),Keychron Cherry Switch - Blue (110 pcs),2,63.36,Keychron,KEYBOARDS - Keypad,G70,"4895248827023,X003A7ZF0L"
KEYC-G71,Keychron Cherry Switch - Brown (110 pcs),Keychron Cherry Switch - Brown (110 pcs),2,63.36,Keychron,KEYBOARDS - Keypad,G71,"4895248827030,X0039YURQH"
KEYC-G72,Keychron Cherry RGB Switch - Red (110 pcs),Keychron Cherry RGB Switch - Red (110 pcs),1,77.4,Keychron,KEYBOARDS - Keypad,G72,"4895248827047,X003A61NEJ"
KEYC-G73,Keychron Cherry RGB Switch - Blue (110 pcs),Keychron Cherry RGB Switch - Blue (110 pcs),7,77.4,Keychron,KEYBOARDS - Keypad,G73,"4895248827054,X003A7V9T7"
KEYC-G74,Keychron Cherry RGB Switch - Brown (110 pcs),Keychron Cherry RGB Switch - Brown (110 pcs),10,77.4,Keychron,KEYBOARDS - Keypad,G74,"4895248827061,X0039YLK0J"
KEYC-G75,Keychron Cherry RGB Switch - Silver (110 pcs),Keychron Cherry RGB Switch - Silver (110 pcs),2,84.42,Keychron,KEYBOARDS - Keypad,G75,"4895248827078,X003AB4OOP"
KEYC-G79,Keychron Kailh Switch Set Red,Keychron Kailh Switch Set Red,6,29.64,Keychron,ACCESSORIES,KEYC-G79,"4895248827115,X003A7ZF15"
KEYC-G8,Keychron Silent K Pro Switch - Brown (110 pcs),Keychron Silent K Pro Switch - Brown (110 pcs),0,42.21,Keychron,KEYBOARDS - Keypad,G8,"4895248821977,X0038GXTRZ"
KEYC-G80,Keychron Kailh Switch Set Blue,Keychron Kailh Switch Set Blue,6,29.64,Keychron,ACCESSORIES,KEYC-G80,"4895248827122,X003A61P3X"
KEYC-G81,Keychron Kailh Switch Set Brown,Keychron Kailh Switch Set Brown,6,29.64,Keychron,ACCESSORIES,KEYC-G81,"4895248827139,X003A61NQH"
KEYC-JM-100,Keychron Double Shot ABS Keycap - Full Set - Light Grey,Keychron Double Shot ABS Keycap - Full Set - Light Grey,2,42.21,Keychron,KEYBOARDS - Keypad,JM-100,4895248812647
KEYC-JM-101,Keychron Double Shot ABS Keycap - Full Set - Retro Color,Keychron Double Shot ABS Keycap - Full Set - Retro Color,0,42.21,Keychron,KEYBOARDS - Keypad,JM-101,4895248812654
KEYC-JM-104,Keychron Double Shot ABS Keycap - Full Set - Grey and White Color,Keychron Double Shot ABS Keycap - Full Set - Grey and White Color,1,42.21,Keychron,KEYBOARDS - Keypad,JM-104,4895248812685
KEYC-JM-202,Keychron Low Profile ABS Keycap Full Keycap Set - Black and Grey,Keychron Low Profile ABS Keycap Full Keycap Set - Black and Grey,2,35.19,Keychron,KEYBOARDS - Keypad,JM-202,"4895248837527,X003JCSPR7"
KEYC-JM-45,Keychron Q1 & K2 OEM Dye-Sub PBT Keycap Set - Wheat Gray,Keychron Q1 & K2 OEM Dye-Sub PBT Keycap Set - Wheat Gray,2,63.36,Keychron,KEYBOARDS - Keypad,JM-45,"4895248812739,X0039LDDYN"
KEYC-JM-70,Keychron Q1 & K2 OEM Dye-Sub PBT Keycap Set - Orange White,Keychron Q1 & K2 OEM Dye-Sub PBT Keycap Set - Orange White,2,63.36,Keychron,KEYBOARDS - Keypad,JM-70,"4895248812814,X0039EGCPR"
KEYC-JM-72,Keychron Q1 & K2 OEM Dye-Sub PBT Keycap Set - Ocean,Keychron Q1 & K2 OEM Dye-Sub PBT Keycap Set - Ocean,2,63.36,Keychron,KEYBOARDS - Keypad,JM-72,"4895248812838,X0039J71DT"
KEYC-JM-73,Keychron Q1 & K2 OEM Dye-Sub PBT Keycap Set - Forest Q1/Q2,Keychron Q1 & K2 OEM Dye-Sub PBT Keycap Set - Forest Q1/Q2,2,63.36,Keychron,KEYBOARDS - Keypad,JM-73,"4895248812692,X0039M9U5N"
KEYC-JM-74,Keychron Keycap Set Christmas Tree PBT Dye-Sub ANSI OEM US Q1 / Q2 / K2 / K6,Keychron Keycap Set Christmas Tree PBT Dye-Sub ANSI OEM US Q1 / Q2 / K2 / K6,10,62.6,Keychron,ACCESSORIES,JM-74,4895248812845
KEYC-JM-75,Keychron OEM Dye-Sub PBT Keycap Set - Christmas Gift Q1/Q2/K2/K6,Keychron OEM Dye-Sub PBT Keycap Set - Christmas Gift Q1/Q2/K2/K6,5,62.6,Keychron,KEYBOARDS - Keypad,JM-75,4895248812852
KEYC-JM-76,Keychron OEM Dye-Sub PBT Keycap Set - Unicorn Q1/Q2/K2,Keychron OEM Dye-Sub PBT Keycap Set - Unicorn Q1/Q2/K2,3,63.36,Keychron,KEYBOARDS - Keypad,JM-76,4895248812869
KEYC-JM-82,Keychron Keycap Set Love PBT Dye-Sub ANSI OEM US Q1 / Q2 / K2 / K6,Keychron Keycap Set Love PBT Dye-Sub ANSI OEM US Q1 / Q2 / K2 / K6,11,62.6,Keychron,ACCESSORIES,JM-82,09420066900433
KEYC-K10P-H1,Keychron K10P-H1 Full Size 104 Key  Red Switch RGB Hot-Swap Keychron K pro Mechanical Wireless QMK Custom Keyboard,Keychron K10P-H1 Full Size 104 Key  Red Switch RGB Hot-Swap Keychron K pro Mechanical Wireless QMK Custom Keyboard,0,180,Keychron,KEYBOARDS - Wireless,K10P-H1,"4895248824114,X003AVAF6L"
KEYC-K10P-H3,Keychron K10P-H3 Full Size 104 Key  Brown Switch RGB Hot-Swap Keychron K pro Mechanical Wireless QMK Custom Keyboard,Keychron K10P-H3 Full Size 104 Key  Brown Switch RGB Hot-Swap Keychron K pro Mechanical Wireless QMK Custom Keyboard,0,180,Keychron,KEYBOARDS - Wireless,K10P-H3,"4895248824138,X003AVABVZ"
KEYC-K10P-Z1,Keychron K10 Pro QMK/VIA Wireless Mechanical Keyboard Black- Barebone (Hot-Swappable) RGB Backlight,Keychron K10 Pro QMK/VIA Wireless Mechanical Keyboard Black- Barebone (Hot-Swappable) RGB Backlight,0,141.17,Keychron,KEYBOARDS - Wireless,K10P-Z1,"4895248824046,X003AMC1OJ"
KEYC-K12-C3,Keychron K12-C3 60% Layout 61 Key - Brown Switch RGB - Wireless Keyboard,Keychron K12-C3 60% Layout 61 Key - Brown Switch RGB - Wireless Keyboard,7,137.2,Keychron,KEYBOARDS - Gaming,K12-C3,X002PHNQ5X
KEYC-K12-J2,Keychron K12-J2 60% Layout 61 Key - Blue Switch RGB Hot-Swap Wireless Keyboard,Keychron K12-J2 60% Layout 61 Key - Blue Switch RGB Hot-Swap Wireless Keyboard,4,151.2,Keychron,KEYBOARDS - Wireless,K12-J2,"4895248807599,X002PHNQ6R"
KEYC-K12-J3,Keychron K12-J3 60% Layout 61 Key - Brown Switch RGB Hot-Swap Wireless Keyboard,Keychron K12-J3 60% Layout 61 Key - Brown Switch RGB Hot-Swap Wireless Keyboard,10,151.2,Keychron,KEYBOARDS - USB,K12-J3,"4895248807605,x002phqy8t"
KEYC-K12P-Z2,Keychron K12 Pro QMK/VIA Wireless Mechanical Keyboard Barebone (Hot-Swappable) RGB Backlight Aluminum Frame,Keychron K12 Pro QMK/VIA Wireless Mechanical Keyboard Barebone (Hot-Swappable) RGB Backlight Aluminum Frame,10,156.09,Keychron,KEYBOARDS - Wireless,K12P-Z2,"4895248845140,X003RKQ4PL"
KEYC-K13P-H1,Keychron K13 Pro H1 Wireless Mechanical Keyboards Swappable Gateron RGB Backlight Red Switch,Keychron K13 Pro H1 Wireless Mechanical Keyboards Swappable Gateron RGB Backlight Red Switch,11,185.82,Keychron,KEYBOARDS - Wireless,K13P-H1,"4895248840756,X003PRO9RL"
KEYC-K13P-H3,Keychron K13 Pro H3 Wireless Mechanical Keyboards Swappable Gateron RGB Backlight Brown Switch,Keychron K13 Pro H3 Wireless Mechanical Keyboards Swappable Gateron RGB Backlight Brown Switch,11,185.82,Keychron,KEYBOARDS - Wireless,K13P-H3,"4895248840770,X003PROBK1"
KEYC-K14P-H1,Keychron K14 Pro Swappable RGB Backlight Red Switch - Black,Keychron K14 Pro Swappable RGB Backlight Red Switch - Black,5,161.91,Keychron,KEYBOARDS - Gaming,K14P-H1,"4895248845270,X003RY3C0R"
KEYC-K14P-H3,Keychron K14 Pro Swappable RGB Backlight Brown Switch - Black,Keychron K14 Pro Swappable RGB Backlight Brown Switch - Black,10,161.91,Keychron,KEYBOARDS - Gaming,K14P-H3,"4895248845287,X003RXW939"
KEYC-K15P-H3,Keychron K15 Pro H3 Wireless Mechanical Keyboards Swappable Gateron RGB Backlight Brown Switch,Keychron K15 Pro H3 Wireless Mechanical Keyboards Swappable Gateron RGB Backlight Brown Switch,4,178.32,Keychron,KEYBOARDS - Wireless,K15P-H3,4895248855248
KEYC-K17P-H1,Keychron K17 Pro H1 Wireless Mechanical Keyboards Swappable Gateron RGB Backlight Red Switch,Keychron K17 Pro H1 Wireless Mechanical Keyboards Swappable Gateron RGB Backlight Red Switch,7,185.82,Keychron,KEYBOARDS - Wireless,K17P-H1,4895248855316
KEYC-K17P-H3,Keychron K17 Pro H3 Wireless Mechanical Keyboards Swappable Gateron RGB Backlight Brown Switch,Keychron K17 Pro H3 Wireless Mechanical Keyboards Swappable Gateron RGB Backlight Brown Switch,12,185.82,Keychron,KEYBOARDS - Wireless,K17P-H3,4895248855330
KEYC-K1M-B1,keychron K1 MAX ANSI 80% TKL 87 Key - Full Assembled - Red Switch RGB - Gateron low profile MX 2.0 Mechanical Wireless / Wired / 2.4GHz Low Profile QMK Custom Keyboard,keychron K1 MAX ANSI 80% TKL 87 Key - Full Assembled - Red Switch RGB - Gateron low profile MX 2.0 Mechanical Wireless / Wired / 2.4GHz Low Profile QMK Custom Keyboard,14,163.5,Keychron,KEYBOARDS - Wireless,K1M-B1,4895248866282
KEYC-K1M-B3,keychron K1 MAX ANSI 80% TKL 87 Key - Full Assembled - Brown Switch RGB - Gateron low profile MX 2.0 Mechanical Wireless / Wired / 2.4GHz Low Profile QMK Custom Keyboard,keychron K1 MAX ANSI 80% TKL 87 Key - Full Assembled - Brown Switch RGB - Gateron low profile MX 2.0 Mechanical Wireless / Wired / 2.4GHz Low Profile QMK Custom Keyboard,12,163.5,Keychron,KEYBOARDS - Wireless,K1M-B3,4895248866305
KEYC-K1P-H1,Keychron K1 Pro Swappable Gateron RGB Backlight Red Switch keyboard,Keychron K1 Pro Swappable Gateron RGB Backlight Red Switch keyboard,6,181.89,Keychron,KEYBOARDS - Gaming,K1P-H1,"4895248839217,X003KK2F51"
KEYC-K1P-H3,Keychron K1 Pro Swappable Gateron RGB Backlight Brown Switch keyboard,Keychron K1 Pro Swappable Gateron RGB Backlight Brown Switch keyboard,0,181.89,Keychron,KEYBOARDS - Gaming,K1P-H3,"4895248839224,X003KK05Y9"
KEYC-K2-C2H,Keychron K2-C2H 75% Layout 84 Key  - Blue Switch RGB Hot-Swap Wireless Keyboard,Keychron K2-C2H 75% Layout 84 Key  - Blue Switch RGB Hot-Swap Wireless Keyboard,40,119.45,Keychron,KEYBOARDS - Gaming,K2-C2H,"4895248804772,x002ibsr2x"
KEYC-K2P-J1,Keychron K2 Pro ANSI 75% Layout 84 Key   Red Switch RGB Hot-Swap Aluminum Frame Gateron G pro Mechanical Wireless Normal Profile Keyboard,Keychron K2 Pro ANSI 75% Layout 84 Key   Red Switch RGB Hot-Swap Aluminum Frame Gateron G pro Mechanical Wireless Normal Profile Keyboard,5,180,Keychron,KEYBOARDS - Keypad,K2P-J1,"4895248805311,X0033AM9LX"
KEYC-K2P-J3,Keychron K2 Pro ANSI 75% Layout 84 Key   Brown Switch RGB Hot-Swap Aluminum Frame Gateron G pro Mechanical Wireless Normal Profile Keyboard,Keychron K2 Pro ANSI 75% Layout 84 Key   Brown Switch RGB Hot-Swap Aluminum Frame Gateron G pro Mechanical Wireless Normal Profile Keyboard,21,180,Keychron,KEYBOARDS - Keypad,K2P-J3,"4895248805335,X0033AXN6D"
KEYC-K3-E1,Keychron K3-E1 75% Layout 84 Key - Red Switch RGB Hot-Swap Wireless Keyboard,Keychron K3-E1 75% Layout 84 Key - Red Switch RGB Hot-Swap Wireless Keyboard,7,130.7,Keychron,KEYBOARDS - Gaming,K3-E1,"4895248805465,X002OUFAJ1"
KEYC-K3M-B1,keychron K3 MAX ANSI 75% layout 84 Key  Full Assembled  Red Switch RGB - Gateron low profile MX 2.0 Mechanical Wireless / Wired / 2.4GHz Low Profile QMK Custom Keyboard,keychron K3 MAX ANSI 75% layout 84 Key  Full Assembled  Red Switch RGB - Gateron low profile MX 2.0 Mechanical Wireless / Wired / 2.4GHz Low Profile QMK Custom Keyboard,8,163.5,Keychron,KEYBOARDS - Wireless,K3M-B1,4895248862680
KEYC-K3M-B3,keychron K3 MAX ANSI 75% layout 84 Key  Full Assembled  Brown Switch RGB - Gateron low profile MX 2.0 Mechanical Wireless / Wired / 2.4GHz Low Profile QMK Custom Keyboard,keychron K3 MAX ANSI 75% layout 84 Key  Full Assembled  Brown Switch RGB - Gateron low profile MX 2.0 Mechanical Wireless / Wired / 2.4GHz Low Profile QMK Custom Keyboard,15,163.5,Keychron,KEYBOARDS - Wireless,K3M-B3,4895248862703
KEYC-K3P-B3,Keychron K3 Pro QMK/VIA Wireless Custom Mechanical Keyboard RGB backlight Brown switch,Keychron K3 Pro QMK/VIA Wireless Custom Mechanical Keyboard RGB backlight Brown switch,0,148.58,Keychron,KEYBOARDS - Gaming,K3P-B3,X003FCSVB1
KEYC-K3P-H1,Keychron K3 Pro ANSI 75% Layout 84 Key  Red Switch RGB Hot-Swap Wireless Custom Keyboard,Keychron K3 Pro ANSI 75% Layout 84 Key  Red Switch RGB Hot-Swap Wireless Custom Keyboard,1,195,Keychron,KEYBOARDS - Wireless,K3P-H1,"4895248832799,X003FCEZJD"
KEYC-K3P-H3,Keychron K3 Pro ANSI 75% Layout 84 Key  Brown Switch RGB Hot-Swap Wireless custom Keyboard,Keychron K3 Pro ANSI 75% Layout 84 Key  Brown Switch RGB Hot-Swap Wireless custom Keyboard,23,195,Keychron,KEYBOARDS - Wireless,K3P-H3,"4895248832812,B0BGR7XM66,X003FCTHZ5"
KEYC-K4-C1,Keychron K4-C1 96% Layout 100 Key - Red Switch RGB - Wireless Keyboard,Keychron K4-C1 96% Layout 100 Key - Red Switch RGB - Wireless Keyboard,4,137.2,Keychron,KEYBOARDS - USB,K4-C1,"4897115550430,4897115559891"
KEYC-K4-J1,Keychron K4-J1 96% Layout 100 Key - Red Switch RGB Hot-Swap Wireless Keyboard,Keychron K4-J1 96% Layout 100 Key - Red Switch RGB Hot-Swap Wireless Keyboard,9,151.2,Keychron,KEYBOARDS - Gaming,K4-J1,"4897115550348,X002OUA5FZ,4895248805786"
KEYC-K4P-G2,Keychron K4 Pro QMK/VIA Wireless Mechanical Keyboard - Blue Switch,Keychron K4 Pro QMK/VIA Wireless Mechanical Keyboard - Blue Switch,2,147.87,Keychron,KEYBOARDS - Gaming,K4P-G2,"4895248837428,X003K5E9U5"
KEYC-K4P-H2,Keychron K4P-H2 96% 100 Key Full Assembled Blue Switch RGB Hot-Swap Keychron K pro Mechanical Wireless QMK Custom Keyboard,Keychron K4P-H2 96% 100 Key Full Assembled Blue Switch RGB Hot-Swap Keychron K pro Mechanical Wireless QMK Custom Keyboard,0,187,Keychron,KEYBOARDS - Wireless,K4P-H2,"4895248837459,X003J9UXXT"
KEYC-K4P-H3,Keychron K4P-H3 96% 100 Key Full Assembled Brown Switch RGB Hot-Swap Keychron K pro Mechanical Wireless QMK Custom Keyboard,Keychron K4P-H3 96% 100 Key Full Assembled Brown Switch RGB Hot-Swap Keychron K pro Mechanical Wireless QMK Custom Keyboard,0,187,Keychron,KEYBOARDS - Wireless,K4P-H3,"4895248837466,X003K5OL8Z"
KEYC-K5M-B1,keychron K5 MAX ANSI Full Size Layout 104 Key  Full Assembled  Red Switch RGB - Low Profile Gateron Mechanical Wireless / Wired / 2.4GHz Low Profile QMK Custom Keyboard,keychron K5 MAX ANSI Full Size Layout 104 Key  Full Assembled  Red Switch RGB - Low Profile Gateron Mechanical Wireless / Wired / 2.4GHz Low Profile QMK Custom Keyboard,4,170.91,Keychron,KEYBOARDS - Wireless,K5M-B1,4895248866961
KEYC-K5M-B3,keychron K5 MAX ANSI Full Size Layout 104 Key  Full Assembled  Brown Switch RGB - Low Profile Gateron Mechanical Wireless / Wired / 2.4GHz Low Profile QMK Custom Keyboard,keychron K5 MAX ANSI Full Size Layout 104 Key  Full Assembled  Brown Switch RGB - Low Profile Gateron Mechanical Wireless / Wired / 2.4GHz Low Profile QMK Custom Keyboard,0,170.91,Keychron,KEYBOARDS - Wireless,K5M-B3,4895248866985
KEYC-K5P-H1,"
Keychron K5 Pro QMK/VIA Wireless Custom Mechanical Keyboard
Black / RGB Backlight / Red (Hot-swappable)","
Keychron K5 Pro QMK/VIA Wireless Custom Mechanical Keyboard
Black / RGB Backlight / Red (Hot-swappable)",16,176.04,Keychron,KEYBOARDS - Gaming,K5P-H1,"4895248839279,X003KK2EW5"
KEYC-K5P-H3,"Keychron K5 Pro QMK/VIA Wireless Custom Mechanical Keyboard
Black / RGB Backlight / Brown (Hot-swappable)","Keychron K5 Pro QMK/VIA Wireless Custom Mechanical Keyboard
Black / RGB Backlight / Brown (Hot-swappable)",10,176.04,Keychron,KEYBOARDS - Gaming,K5P-H3,"4895248839286,X003KK2F2J"
KEYC-K6P-J1,Keychron K6P-J1 80% TKL Layout 87 Key - Red Switch RGB Hot-Swap Wireless Keyboard,Keychron K6P-J1 80% TKL Layout 87 Key - Red Switch RGB Hot-Swap Wireless Keyboard,5,180,Keychron,KEYBOARDS - Keypad,K6P-J1,"4895248806189,X003370KIZ"
KEYC-K6P-J3,Keychron K6P-J3 80% TKL Layout 87 Key - Brown Switch RGB Hot-Swap Wireless Keyboard,Keychron K6P-J3 80% TKL Layout 87 Key - Brown Switch RGB Hot-Swap Wireless Keyboard,7,180,Keychron,KEYBOARDS - Keypad,K6P-J3,"4895248806202,X003370KJ9"
KEYC-K6P-Z1,Keychron K6 Pro QMK/VIA Wireless Custom Mechanical Keyboard ,Keychron K6 Pro QMK/VIA Wireless Custom Mechanical Keyboard ,9,141.17,Keychron,KEYBOARDS - Wireless,K6P-Z1,"4895248806080,X00338HVTP"
KEYC-K8-B1,Keychron K8-B1 80% TKL Layout 87 Key - Red Switch RGB - Wireless Keyboard,Keychron K8-B1 80% TKL Layout 87 Key - Red Switch RGB - Wireless Keyboard,19,123.1,Keychron,KEYBOARDS - USB,K8-B1,4897115556104
KEYC-K8-B2,Keychron K8-B2 80% TKL Layout 87 Key - Blue Switch RGB - Wireless Keyboard,Keychron K8-B2 80% TKL Layout 87 Key - Blue Switch RGB - Wireless Keyboard,21,123.1,Keychron,KEYBOARDS - Keypad,K8-B2,"4897115556111,X002JYAIYT"
KEYC-K8-B3,Keychron K8-B3 80% TKL Layout 87 Key - Brown Switch RGB - Wireless Keyboard,Keychron K8-B3 80% TKL Layout 87 Key - Brown Switch RGB - Wireless Keyboard,1,123.1,Keychron,KEYBOARDS - Keypad,K8-B3,"4897115556128,X002JY7ZO5"
KEYC-K8-C1,Keychron K8-C1 80% TKL Layout 87 Key - Red Switch RGB - Wireless Keyboard,Keychron K8-C1 80% TKL Layout 87 Key - Red Switch RGB - Wireless Keyboard,16,137.2,Keychron,KEYBOARDS - Gaming,K8-C1,4897115556135
KEYC-K8-C2,Keychron K8-C2 80% TKL Layout 87 Key - Blue Switch RGB - Wireless Keyboard,Keychron K8-C2 80% TKL Layout 87 Key - Blue Switch RGB - Wireless Keyboard,16,137.2,Keychron,KEYBOARDS - Gaming,K8-C2,"X002HY2E1B,4897115556142"
KEYC-K8P-J1,Keychron K8P-J1 80% TKL Layout 87 Key - Red Switch RGB Hot-Swap Wireless Keyboard,Keychron K8P-J1 80% TKL Layout 87 Key - Red Switch RGB Hot-Swap Wireless Keyboard,5,180,Keychron,KEYBOARDS - Keypad,K8P-J1,"4895248806899,X0033CDLSB"
KEYC-K8P-J2,Keychron K8P-J2 80% TKL Layout 87 Key - Blue Switch RGB Hot-Swap Wireless Keyboard,Keychron K8P-J2 80% TKL Layout 87 Key - Blue Switch RGB Hot-Swap Wireless Keyboard,7,180,Keychron,KEYBOARDS - Keypad,K8P-J2,"4895248806905,X0033CCRK9"
KEYC-K8P-J3,Keychron K8P-J3 80% TKL Layout 87 Key - Brown Switch RGB Hot-Swap Wireless Keyboard,Keychron K8P-J3 80% TKL Layout 87 Key - Brown Switch RGB Hot-Swap Wireless Keyboard,9,180,Keychron,KEYBOARDS - Keypad,K8P-J3,"4895248806912,X0033CCO5H"
