StockCode,GCode,Vendor,PartNo,Description,RRP,ETA,Block1_Price,Block2_Price,Block3_Price,ProductGroup,Stock,EAN,UPC,APN
RZ02-03330400-R3M1,82154,Razer,RZ02-03330400-R3M1,RAZER GIGANTUS V2 - SOFT GAMING MOUSE MAT XXL - FRML PACKAGING,64.99,,48.04,48.04,48.04,Mouse - Gaming,30,,8.88642E+12,
RZ02-03330500-R3M1,82155,Razer,RZ02-03330500-R3M1,RAZER GIGANTUS V2 - SOFT GAMING MOUSE MAT 3XL - FRML PACKAGING,109.99,,81.3,81.3,81.3,Mouse - Gaming,1,,,
RZ02-03810300-R3M1,88098,Razer,RZ02-03810300-R3M1,RAZER STRIDER - HYBRID GAMING MOUSE MAT - LARGE - QUARTZ EDITION - FRML PACKAGING,69.99,,51.73,51.73,51.73,Mouse - Gaming,30,8.88791E+12,,
RZ03-03390100-R3M1,82477,Razer,RZ03-03390100-R3M1,RAZER HUNTSMAN MINI - 60% OPTICAL GAMING KEYBOARD (CLICKY PURPLE SWITCH) - FRML PACKAGING,209.99,,148.68,148.68,148.68,Keyboard - Gaming,12,,888 64193 4573 2,
RZ03-03390300-R3M1,82478,Razer,RZ03-03390300-R3M1,RAZER HUNTSMAN MINI - MERCURY EDITION - 60% OPTICAL GAMING KEYBOARD (CLICKY PURPLE SWITCH) - FRML PACKAGING,189.99,,148.68,148.68,148.68,Keyboard - Gaming,30,,888 64193 4575 6,
RZ03-03390400-R3M1,84607,Razer,RZ03-03390400-R3M1,RAZER HUNTSMAN MINI - MERCURY EDITION - 60% OPTICAL GAMING KEYBOARD (LINEAR RED SWITCH) - FRML PACKAGING,209.99,,148.69,148.69,148.69,Keyboard - Gaming,30,888 64193 4576 3,,
RZ03-03490100-R3M1,82713,Razer,RZ03-03490100-R3M1,RAZER BLACKWIDOW V3 TENKEYLESS - MECHANICAL GAMING KEYBOARD - US LAYOUT - FRML PACKAGING,189.99,,148.69,148.69,148.69,Keyboard - Gaming,30,,,
RZ03-03530100-R3M1,82853,Razer,RZ03-03530100-R3M1,RAZER BLACKWIDOW V3 PRO - WIRELESS MECHANICAL GAMING KEYBOARD (GREEN SWITCH) - US LAYOUT - FRML PACKAGING,419.99,,328.69,328.69,328.69,Keyboard - Gaming,25,888 64193 4529 9,,
RZ03-03942000-R3M1,88096,Razer,RZ03-03942000-R3M1,RAZER HUNTSMAN V2 TENKEYLESS - OPTICAL GAMING KEYBOARD (LINEAR RED SWITCH) - QUARTZ EDITION - US LAYOUT - FRML,289.99,,226.95,226.95,226.95,Keyboard - Gaming,30,8.88642E+12,,
RZ03-04360100-R3M1,87550,Razer,RZ03-04360100-R3M1,RAZER DEATHSTALKER V2 PRO - WIRELESS LOW PROFILE OPTICAL GAMING KEYBOARD (LINEAR RED SWITCH) - US LAYOUT - FRML,399.99,,256.69,256.69,256.69,Keyboard - Gaming,30,8.88642E+12,,
RZ03-04363500-R3M1,88088,Razer,RZ03-04363500-R3M1,RAZER DEATHSTALKER V2 PRO - WIRELESS LOW PROFILE OPTICAL GAMING KEYBOARD (CLICKY PURPLE SWITCH) - WHITE EDITION - US LAYOUT - WORLD PACKAGING,409.99,,320.86,320.86,320.86,Keyboard - Gaming,14,8.88642E+12,,
RZ03-04370100-R3M1,87628,Razer,RZ03-04370100-R3M1,RAZER DEATHSTALKER V2 PRO TENKEYLESS - WIRELESS LOW PROFILE OPTICAL GAMING KEYBOARD (LINEAR RED SWITCH) - US LAYOUT - FRML,399,,244.17,244.17,244.17,Keyboard - Gaming,30,8.88642E+12,,
RZ03-04373500-R3M1,88117,Razer,RZ03-04373500-R3M1,RAZER DEATHSTALKER V2 PRO TENKEYLESS - WIRELESS LOW PROFILE OPTICAL GAMING KEYBOARD (LINEAR RED SWITCH) - WHITE EDITION - US LAYOUT - WORLD PACKAGING,389.99,TBC,305.21,305.21,305.21,Keyboard - Gaming,0,8.88642E+12,,
RZ03-04460100-R3M1,86426,Razer,RZ03-04460100-R3M1,RAZER ORNATA V3 - LOW PROFILE GAMING KEYBOARD - US LAYOUT - FRML,139.99,,109.56,109.56,109.56,Keyboard - Gaming,30,,,
RZ03-04470100-R3M1,86415,Razer,RZ03-04470100-R3M1,RAZER ORNATA V3 X - LOW PROFILE GAMING KEYBOARD - US LAYOUT - FRML,79.99,,62.6,62.6,62.6,Keyboard - Gaming,30,8.88642E+12,,
RZ03-04500100-R3M1,87549,Razer,RZ03-04500100-R3M1,RAZER DEATHSTALKER V2 -LOW PROFILE OPTICAL GAMING KEYBOARD (LINEAR RED SWITCH) -US LAYOUT - FRML,319.99,,206.6,206.6,206.6,Keyboard - Gaming,30,8.88642E+12,,
RZ03-04880100-R3M1,88121,Razer,RZ03-04880100-R3M1,RAZER ORNATA V3 TENKEYLESS - LOW PROFILE GAMING KEYBOARD - US LAYOUT - FRML,139.99,,109.55,109.55,109.55,Keyboard - Gaming,30,,8.88791E+12,
RZ04-03220100-R3M1,82850,Razer,RZ04-03220100-R3M1,RAZER BLACKSHARK V2 PRO,329.99,,258.25,258.25,258.25,Headphone - Gaming,30,,,
RZ04-03220300-R3M1,85894,Razer,RZ04-03220300-R3M1,RAZER BLACKSHARK V2 PRO - WIRELESS GAMING HEADSET - WHITE EDITION - FRML PACKAGING,329.99,,206.6,206.6,206.6,Headphone - Gaming,10,8.88642E+12,,
RZ04-03230100-R3M1,82480,Razer,RZ04-03230100-R3M1,RAZER BLACKSHARK V2 - MULTI-PLATFORM WIRED ESPORTS HEADSET WITH USB SOUND CARD - FRML PACKAGING,189.99,TBC,148.69,148.69,148.69,Headphone - Gaming,0,,888 64193 7837 2,
RZ04-03240100-R3M1,82479,Razer,RZ04-03240100-R3M1,RAZER BLACKSHARK V2 X - MULTI-PLATFORM WIRED ESPORTS HEADSET - FRML PACKAGING,119.99,,93.91,93.91,93.91,Headphone - Gaming,30,,888 64193 7839 6,
RZ04-03240800-R3M1,88099,Razer,RZ04-03240800-R3M1,RAZER BLACKSHARK V2 X - WIRED GAMING HEADSET - QUARTZ EDITION - FRML PACKAGING,129.99,,103.73,103.73,103.73,Headphone - Gaming,30,8.88791E+12,,
RZ04-03480100-R3M1,83409,Razer,RZ04-03480100-R3M1,RAZER KAIRA FOR XBOX - WIRELESS GAMING HEADSET FOR XBOX SERIES X - EU/AU/NZ/CHN/SG PACKAGING,199.99,,148.69,148.69,148.69,Headphone - Gaming,30,888 64193 7862 4,,
RZ04-03520100-R3M1,83236,Razer,RZ04-03520100-R3M1,RAZER KRAKEN BT HEADSET - KITTY EDITION - QUARTZ - FRML PACKAGING,189.99,,148.69,148.69,148.69,Headphone - Gaming,30,888 64193 7872 3,,
RZ04-03790300-R3M1,88097,Razer,RZ04-03790300-R3M1,RAZER BARRACUDA - WIRELESS MULTI-PLATFORM GAMING AND MOBILE HEADSET - QUARTZ PINK - FRML PACKAGING,309.99,TBC,242.6,242.6,242.6,Headphone - Gaming,0,8.88642E+12,,
RZ04-03980100-R3M1,85978,Razer,RZ04-03980100-R3M1,RAZER KAIRA FOR PLAYSTATION - WIRELESS GAMING HEADSET FOR PS5 - WHITE - FRML PACKAGING,199.99,,140.86,140.86,140.86,Game Console Accessory,30,8.88642E+12,,
RZ04-04430100-R3M1,88092,Razer,RZ04-04430100-R3M1,RAZER BARRACUDA X (2022) - WIRELESS MULTI-PLATFORM GAMING AND MOBILE HEADSET - FRML PACKAGING,189.99,,148.69,148.69,148.69,Headphone - Gaming,30,,8.88642E+12,
RZ04-04430200-R3M1,88093,Razer,RZ04-04430200-R3M1,RAZER BARRACUDA X (2022) - WIRELESS MULTI-PLATFORM GAMING AND MOBILE HEADSET - MERCURY WHITE - FRML PACKAGING,189.99,,148.69,148.69,148.69,Headphone - Gaming,30,,8.88642E+12,
RZ04-04430300-R3M1,88094,Razer,RZ04-04430300-R3M1,RAZER BARRACUDA X (2022) - WIRELESS MULTI-PLATFORM GAMING AND MOBILE HEADSET - QUARTZ PINK - FRML PACKAGING,189.99,,148.69,148.69,148.69,Headphone - Gaming,30,,8.88642E+12,
RZ04-04530100-R3M1,88628,Razer,RZ04-04530100-R3M1,RAZER BLACKSHARK V2 PRO (2023) - WIRELESS GAMING HEADSET - FRML PACKAGING,369.99,,289.56,289.56,289.56,Headphone - Gaming,28,,8.88791E+12,
RZ04-04530200-R3M1,88629,Razer,RZ04-04530200-R3M1,RAZER BLACKSHARK V2 PRO (2023) - WIRELESS GAMING HEADSET - WHITE EDITION - FRML PACKAGING,369.99,,289.56,289.56,289.56,Headphone - Gaming,30,,8.88791E+12,
RZ05-03920100-R3U1,87256,Razer,RZ05-03920100-R3U1,RAZER LEVIATHAN V2 - PC GAMING SOUND BAR WITH SUBWOOFER - US/CAN + AUS/NZ PACKAGING (SP12N+SP-501A),449.99,,352.17,352.17,352.17,Game Console Accessory,30,8.88642E+12,,
RZ05-04280100-R3M1,87088,Razer,RZ05-04280100-R3M1,RAZER LEVIATHAN V2 X - PC GAMING SOUND BAR - FRML PACKAGING,209.99,,172.13,172.13,172.13,Game Console Accessory,30,,,
RZ06-03560100-R3M1,83408,Razer,RZ06-03560100-R3M1,RAZER WOLVERINE V2 - WIRED GAMING CONTROLLER FOR XBOX SERIES X - FRML PACKAGING,189.99,,156.95,156.95,156.95,Game Console Accessory,30,888 64193 5099 6,,
RZ06-04180100-R3M1,87082,Razer,RZ06-04180100-R3M1,RAZER KISHI V2 - GAMING CONTROLLER FOR ANDROID - FRML PACKAGING,199.99,,148.66,148.66,148.66,Game Console Accessory,30,8.88642E+12,,
RZ07-02270100-R3M1,81270,Razer,RZ07-02270100-R3M1,RAZER TARTARUS V2 MECHA-MEMBRANE GAMING KEYPAD - FRML,159.99,,125.21,125.21,125.21,Keyboard - Gaming,30,,8.88642E+12,
RZ07-03110100-R3M1,81271,Razer,RZ07-03110100-R3M1,RAZER TARTARUS PRO - ANALOG OPTICAL GAMING KEYPAD - FRML PACKAGING,259.99,,203.47,203.47,203.47,Keyboard - Gaming,16,,8.88642E+12,
RZ12-03820100-R3A1,85379,Razer,RZ12-03820100-R3A1,RAZER HAMMERHEAD TRUE WIRELESS (NEW 2021) - EARBUDS - BLACK - AP PACKAGING,239.99,,187.8,187.8,187.8,Headphone - Gaming,30,8.88642E+12,,
RZ19-02320100-R3M1,81275,Razer,RZ19-02320100-R3M1,RAZER KIYO - DESKTOP CAMERA FOR STREAMING WITH ILLUMINATION - FRML,199.99,,156.51,156.51,156.51,Game Console Accessory,30,,8.88642E+12,
RZ19-03450100-R3M1,83122,Razer,RZ19-03450100-R3M1,RAZER SEIREN MINI - ULTRA-COMPACT CONDENSER MICROPHONE - FRML PACKAGING,99.99,,78.25,78.25,78.25,Game Console Accessory,30,,,
RZ19-03450200-R3M1,83124,Razer,RZ19-03450200-R3M1,RAZER SEIREN MINI - ULTRA-COMPACT CONDENSER MICROPHONE - QUARTZ - FRML PACKAGING,99.99,,78.25,78.25,78.25,Game Console Accessory,30,,,
RZ19-03450300-R3M1,83123,Razer,RZ19-03450300-R3M1,RAZER SEIREN MINI - ULTRA-COMPACT CONDENSER MICROPHONE - MERCURY - FRML PACKAGING,99.99,,78.25,78.25,78.25,Game Console Accessory,30,,,
RZ19-04170100-R3M1,85709,Razer,RZ19-04170100-R3M1,RAZER KIYO X - USB BROADCASTING CAMERA - FRML PACKAGING,159.99,,106.99,106.99,106.99,Game Console Accessory,30,,,
RZ38-03880100-R3U1,85315,Razer,RZ38-03880100-R3U1,RAZER ENKI X - ESSENTIAL GAMING CHAIR FOR ALL-DAY COMFORT,549.99,,419.36,419.36,419.36,Gaming Chair,16,8.88642E+12,,
RZ81-01990100-B3M1,87087,Razer,RZ81-01990100-B3M1,RAZER MOUSE DOCK PRO - FRML PACKAGING,169.99,,115.55,115.55,115.55,Mouse - Gaming,30,,,
SA400S37/240G,74405,Kingston,SA400S37/240G,"KINGSTON A400 240GB SATA 3 2.5"" SSD",49,,29,29,29,SSD Hard Drive - Internal,12,,,
SA400S37/480G,74406,Kingston,SA400S37/480G,"KINGSTON A400 480GB SATA 3 2.5"" SSD",65,,42,42,42,SSD Hard Drive - Internal,2,,,
SB-CT14BD,73608,Alogic,SB-CT14BD,ALOGIC SMARTBOX 14 BAY NOTEBOOK & TABLET CHARGING CABINET - UP TO 14-INCH DEVICES,879.99,,688.69,688.69,688.69,Power Products,22,9.35078E+12,,
SB-CT24B156,74998,Alogic,SB-CT24B156,"ALOGIC SMARTBOX 24 BAY NOTEBOOK/CHROMEBOOK & TABLET CHARGING TROLLEY - UP TO 15.6"" DEVICES",1799.99,26/07/2023,1408.69,1408.69,1408.69,Power Products,0,9.35078E+12,,
SB-CT32B156,74999,Alogic,SB-CT32B156,"ALOGIC SMARTBOX 32 BAY NOTEBOOK/CHROMEBOOK & TABLET CHARGING TROLLEY - UP TO 15.6"" DEVICES",2199.99,26/07/2023,1721.73,1721.73,1721.73,Power Products,0,9.35078E+12,,
SB-CT42B156,75099,Alogic,SB-CT42B156,"ALOGIC SMARTBOX 42 BAY NOTEBOOK/CHROMEBOOK & TABLET CHARGING TROLLEY UP TO 15.6"" DEVICES",2599.99,26/07/2023,2034.77,2034.77,2034.77,Power Products,0,9.35078E+12,,
SB-M10G2,76614,Alogic,SB-M10G2,ALOGIC SMARTBOX 10 BAY G2 ANDROID AND IPAD SYNC & CHARGING CABINET,749.99,,586.95,586.95,586.95,Power Products,12,9.35078E+12,,
SDCFXPS-032G-X46,77722,SanDisk,SDCFXPS-032G-X46,"SANDISK EXTREME PRO CF, CFXPS 32GB, VPG65, UDMA 7, 160MB/S R, 150MB/S W, 4X6, LIFETIME LIMITED",156.99,,109.68,109.68,109.68,Memory Card,12,6.19659E+11,,
SDCFXPS-064G-X46,77723,SanDisk,SDCFXPS-064G-X46,"SANDISK EXTREME PRO CF, CFXPS 64GB, VPG65, UDMA 7, 160MB/S R, 150MB/S W, 4X6, LIFETIME LIMITED",168.99,,129.29,129.29,129.29,Memory Card,10,,,
SDCS2/128GB,81288,Kingston,SDCS2/128GB,KINGSTON 128GB MICROSDXC UHS-1 CANVAS SELECT PLUS MEMORY CARD WITH SD ADAPTER,25,,11.9,11.9,11.9,Memory Card,30,,,
SDCS2/256GB,81287,Kingston,SDCS2/256GB,KINGSTON 256GB MICROSDXC UHS-1 CANVAS SELECT PLUS MEMORY CARD WITH SD ADAPTER,59,,28.5,28.5,28.5,Memory Card,21,,,
SDCS2/32GB,81153,Kingston,SDCS2/32GB,KINGSTON 32GB MICROSDHC CANVAS SELECT PLUS CL10 UHS-I CARD+SD ADAPTER UP TO 100/85 MB/S READ/WRITE,9,,5.6,5.6,5.6,Memory Card,30,,7.40617E+11,
SDCS2/512GB,81286,Kingston,SDCS2/512GB,KINGSTON 512GB MICROSDXC UHS-1 CANVAS SELECT PLUS MEMORY CARD WITH SD ADAPTER,109,,69,69,69,Memory Card,5,,,
SDCS2/64GB,81289,Kingston,SDCS2/64GB,KINGSTON 64GB MICROSDXC UHS-1 CANVAS SELECT PLUS MEMORY CARD WITH SD ADAPTER,15,,6.9,6.9,6.9,Memory Card,30,,,
SDCZ48-032G-G462,82517,SanDisk,SDCZ48-032G-G462,"SANDISK ULTRA USB 3.0 FLASH DRIVE, CZ48 32GB, USB3.0, DUAL PACK, BLUE, RED, STYLISH SLEEK DESIGN, 5Y",39.99,19/07/2023,27.82,27.82,27.82,USB Flash Drive,0,6.19659E+11,,
SDCZ48-128G-U46,77727,SanDisk,SDCZ48-128G-U46,SANDISK ULTRA USB 3.0 FLASH DRIVE CZ48 128GB USB3.0 BLACK STYLISH SLEEK DESIGN 5Y,89.99,,69,69,69,USB Flash Drive,30,,6.19659E+11,
SDCZ600-032G-G35,74576,SanDisk,SDCZ600-032G-G35,SANDISK CRUZER GLIDE 3.0 USB FLASH DRIVE CZ600 32GB USB3.0 BLACK WITH RED SLIDER RETRACTABLE DESIGN 5Y,19.99,,16.36,16.36,16.36,USB Flash Drive,30,,,
SDCZ60-032G-B35,77496,SanDisk,SDCZ60-032G-B35,SANDISK CRUZER GLIDE USB FLASH DRIVE CZ60 32GB USB2.0 BLACK RETRACTABLE DESIGN 5Y,24.99,TBC,17.38,17.38,17.38,USB Flash Drive,0,,6.19659E+11,
SDCZ60-128G-B35,81505,SanDisk,SDCZ60-128G-B35,SANDISK CRUZER GLIDE USB FLASH DRIVE CZ60 128GB USB2.0 BLACK RETRACTABLE DESIGN 5Y,79.99,,16.99,16.99,16.99,USB Flash Drive,30,,6.19659E+11,
SDCZ62-032G-G35,81479,SanDisk,SDCZ62-032G-G35,SANDISK CRUZER SNAP USB FLASH DRIVE CZ62 32GB USB2.0 BLACK RETRACTABLE DESIGN 5Y,19.99,,13.91,13.91,13.91,USB Flash Drive,8,,6.19659E+11,
SDCZ62-032G-G35B,82521,SanDisk,SDCZ62-032G-G35B,SANDISK CRUZER SNAP USB FLASH DRIVE CZ62 32GB USB2.0 BLUE RETRACTABLE DESIGN 5Y,19.99,,13.91,13.91,13.91,USB Flash Drive,5,,,
SDCZ62-064G-G35,81480,SanDisk,SDCZ62-064G-G35,SANDISK CRUZER SNAP USB FLASH DRIVE CZ62 64GB USB2.0 BLACK RETRACTABLE DESIGN 5Y,39.99,,24.34,24.34,24.34,USB Flash Drive,30,,6.19659E+11,
SDCZ62-128G-G35,82522,SanDisk,SDCZ62-128G-G35,SANDISK CRUZER SNAP USB FLASH DRIVE CZ62 128GB USB2.0 BLACK RETRACTABLE DESIGN 5Y,59.99,,41.73,41.73,41.73,USB Flash Drive,30,6.19659E+11,6.19659E+11,
SDCZ74-032G-G46,81507,SanDisk,SDCZ74-032G-G46,SANDISK ULTRA LUXE USB 3.1 FLASH DRIVE CZ74 32GB USB3.1 FULL CAST METAL 5Y,33.99,19/07/2023,20.86,20.86,20.86,USB Flash Drive,0,6.19659E+11,6.19659E+11,
SDCZ74-064G-G46,81508,SanDisk,SDCZ74-064G-G46,SANDISK ULTRA LUXE USB 3.1 FLASH DRIVE CZ74 64GB USB3.1 FULL CAST METAL 5Y,65.99,,31.3,31.3,31.3,USB Flash Drive,30,,6.19659E+11,
SDCZ74-128G-G46,81509,SanDisk,SDCZ74-128G-G46,"SANDISK ULTRA LUXE USB 3.1 FLASH DRIVE, CZ74 128GB, USB3.1, FULL CAST METAL, 5Y",79.99,,29.88,29.88,29.88,USB Flash Drive,30,,6.19659E+11,
SDCZ74-256G-G46,81510,SanDisk,SDCZ74-256G-G46,SANDISK ULTRA LUXE USB 3.1 FLASH DRIVE CZ74 256GB USB3.1 FULL CAST METAL 5Y,199.99,,104.34,104.34,104.34,USB Flash Drive,8,,6.19659E+11,
SDDDC2-032G-G46,77509,SanDisk,SDDDC2-032G-G46,"SANDISK ULTRA DUAL DRIVE USB TYPE C, SDDDC2 32GB, USB TYPE C, BLACK, USB3.1/TYPE C REVERSIBLE CONNECTOR, RETRACTABLE DESIGN , TYPE-C",29.99,,19.99,19.99,19.99,USB Flash Drive,30,,6.19659E+11,
SDDDC4-032G-G46,82527,SanDisk,SDDDC4-032G-G46,SANDISK ULTRA DUAL DRIVE LUXE SDDDC4 32GB USB TYPE C METAL USB3.1/TYPE C REVERSIBLE CONNECTOR SWIVEL DESIGN TYPE-C ENABLED DEVICES 5Y,39.99,19/07/2023,27.82,27.82,27.82,USB Flash Drive,0,,,
SDDDC4-064G-G46,82528,SanDisk,SDDDC4-064G-G46,SANDISK ULTRA DUAL DRIVE LUXE SDDDC4 64GB USB TYPE C METAL USB3.1/TYPE C REVERSIBLE CONNECTOR SWIVEL DESIGN TYPE-C ENABLED DEVICES 5Y,59.99,,41.73,41.73,41.73,USB Flash Drive,14,,,
SDDDC4-128G-G46,82529,SanDisk,SDDDC4-128G-G46,SANDISK ULTRA DUAL DRIVE LUXE SDDDC4 128GB USB TYPE C METAL USB3.1/TYPE C REVERSIBLE CONNECTOR SWIVEL DESIGN TYPE-C ENABLED DEVICES 5Y,99.99,,69.56,69.56,69.56,USB Flash Drive,29,,,
SDDDC4-256G-G46,82530,SanDisk,SDDDC4-256G-G46,SANDISK ULTRA DUAL DRIVE LUXE SDDDC4 256GB USB TYPE C METAL USB3.1/TYPE C REVERSIBLE CONNECTOR SWIVEL DESIGN TYPE-C ENABLED DEVICES 5Y,159.99,,111.3,111.3,111.3,USB Flash Drive,30,,6.19659E+11,
SDDDC4-512G-G46,82531,SanDisk,SDDDC4-512G-G46,SANDISK ULTRA DUAL DRIVE LUXE SDDDC4 512GB USB TYPE C METAL USB3.1/TYPE C REVERSIBLE CONNECTOR SWIVEL DESIGN TYPE-C ENABLED DEVICES 5Y,289.99,19/07/2023,201.73,201.73,201.73,USB Flash Drive,0,,6.19659E+11,
SDDR-409-G46,77798,SanDisk,SDDR-409-G46,SANDISK EXTREME PRO SD UHS-II USB-C READER/WRITER 2Y,49,,39,39,39,Memory Card,9,,,
SDIX90N-064G-GN6NK,84824,SanDisk,SDIX90N-064G-GN6NK,"SANDISK IXPAND FLASH DRIVE FLIP, SDIX90N 064GB, MINT GREEN, IOS, USB 3.0, 2Y",87.99,TBC,60.97,60.97,60.97,USB Flash Drive,0,6.19659E+11,6.19659E+11,
SDIX90N-064G-GN6NN,84823,SanDisk,SDIX90N-064G-GN6NN,"SANDISK IXPAND FLASH DRIVE FLIP, SDIX90N 064GB, BLACK, IOS, USB 3.0, 2Y",87.99,TBC,60.97,60.97,60.97,USB Flash Drive,0,6.19659E+11,,
SDIX90N-128G-GN6NE,84825,SanDisk,SDIX90N-128G-GN6NE,"SANDISK IXPAND FLASH DRIVE FLIP, SDIX90N 128GB, BLACK, IOS, USB 3.0, 2Y",122.99,TBC,85.81,85.81,85.81,USB Flash Drive,0,6.19659E+11,,
SDIX90N-128G-GN6NJ,84826,SanDisk,SDIX90N-128G-GN6NJ,"SANDISK IXPAND FLASH DRIVE FLIP, SDIX90N 128GB, MINT GREEN, IOS, USB 3.0, 2Y",122.99,,85.81,85.81,85.81,USB Flash Drive,30,6.19659E+11,,
SDIX90N-256G-GN6NE,84827,SanDisk,SDIX90N-256G-GN6NE,"SANDISK IXPAND FLASH DRIVE FLIP, SDIX90N 256GB, BLACK, IOS, USB 3.0, 2Y",199.99,,139.35,139.35,139.35,USB Flash Drive,30,6.19659E+11,6.19659E+11,
SDS2/256GB,81291,Kingston,SDS2/256GB,"KINGSTON 256GB CANVAS SELECT PLUS UHS-I SDXC MEMORY CARD, Read/Write 100/85MB/s",55,,31,31,31,Memory Card,1,,,
SDS2/512GB,81290,Kingston,SDS2/512GB,"KINGSTON 512GB CANVAS SELECT PLUS UHS-I SDXC MEMORY CARD, Read/Write 100/85MB/s",139,20/07/2023,74,74,74,Memory Card,0,,,
SDS2/64GB,81293,Kingston,SDS2/64GB,KINGSTON 64GB CANVAS SELECT PLUS UHS-I SDXC MEMORY CARD,25,,8.9,8.9,8.9,Memory Card,2,,7.40617E+11,
SDSDUN4-032G-GN6IN,83302,SanDisk,SDSDUN4-032G-GN6IN,SANDISK ULTRA SDHC SDUN4 32GB C10 UHS-I 120MB/S R 4X6 10Y,21.99,,17.21,17.21,17.21,Memory Card,30,,6.19659E+11,
SDSDUNB-064G-GN6IN,87314,SanDisk,SDSDUNB-064G-GN6IN,SANDISK ULTRA SDXC SDUNB 64GB C10 UHS-I 140MB/S R 4X6 10Y,34.99,,27.38,27.38,27.38,Memory Card,30,,6.19659E+11,
SDSDUNB-128G-GN6IN,87315,SanDisk,SDSDUNB-128G-GN6IN,SANDISK ULTRA SDXC SDUNB 128GB C10 UHS-I 140MB/S R 4X6 10Y,59.99,,46.95,46.95,46.95,Memory Card,30,,6.19659E+11,
SDSDUNC-256G-GN6IN,87316,SanDisk,SDSDUNC-256G-GN6IN,SANDISK ULTRA SDXC SDUNC 256GB C10 UHS-I 150MB/S R 4X6 10Y,129.99,,101.73,101.73,101.73,Memory Card,30,,6.19659E+11,
SDSDXDK-032G-GN4IN,84837,SanDisk,SDSDXDK-032G-GN4IN,"SANDISK EXTREME PRO SDHC, SDXDK 32GB, V90, U3, C10, UHS-II, 300MB/S R, 260MB/S W, 4X6, LIFETIME LIMITED",224.99,,157.38,157.38,157.38,Memory Card,30,6.19659E+11,6.19659E+11,
SDSDXDK-128G-GN4IN,84838,SanDisk,SDSDXDK-128G-GN4IN,"SANDISK EXTREME PRO SDXC, SDXDK 128GB, V90, U3, C10, UHS-II, 300MB/S R, 260MB/S W, 4X6, LIFETIME LIMITED",999,TBC,300.38,300.38,300.38,Memory Card,0,6.19659E+11,,
SDSDXV2-064G-GNCIN,86909,SanDisk,SDSDXV2-064G-GNCIN,SANDISK EXTREME SDXC SDXV2 64GB V30 U3 C10 UHS-I 170MB/S R 80MB/S W 4X6 LIFETIME LIMITED,47.99,,39.12,39.12,39.12,Memory Card,30,,6.19659E+11,
SDSDXVA-128G-GNCIN,86910,SanDisk,SDSDXVA-128G-GNCIN,SANDISK EXTREME SDXC SDXVA 128GB V30 U3 C10 UHS-I 180MB/S R 90MB/S W 4X6 LIFETIME LIMITED,92.99,,62.6,62.6,62.6,Memory Card,30,,6.19659E+11,
SDSDXVT-032G-GNCIN,86908,SanDisk,SDSDXVT-032G-GNCIN,SANDISK EXTREME SDHC SDXVT 32GB V30 U3 C10 UHS-I 100MB/S R 60MB/S W 4X6 LIFETIME LIMITED,32.99,19/07/2023,23.47,23.47,23.47,Memory Card,0,,,
SDSDXVV-256G-GNCIN,87077,SanDisk,SDSDXVV-256G-GNCIN,"SANDISK EXTREME SDXC, SDXVV 256GB, V30, U3, C10, UHS-I, 180MB/S R, 130MB/S W, 4X6, LIFETIME LIMITED",149.99,26/07/2023,117.38,117.38,117.38,Memory Card,0,,6.19659E+11,
SDSDXXD-128G-GN4IN,86913,SanDisk,SDSDXXD-128G-GN4IN,SANDISK EXTREME PRO SDXC SDXXD 128GB V30 U3 C10 UHS-I 200MB/S R 90MB/S W 4X6 LIFETIME LIMITED,99.99,,78.25,78.25,78.25,Memory Card,30,,,
SDSDXXD-1T00-GN4IN,87079,SanDisk,SDSDXXD-1T00-GN4IN,"SANDISK EXTREME PRO SDXC, SDXXD 1TB, V30, U3, C10, UHS-I, 200MB/S R, 140MB/S W, 4X6, LIFETIME LIMITED",544.69,,453.91,453.91,453.91,Memory Card,23,,6.19659E+11,
SDSDXXD-256G-GN4IN,86914,SanDisk,SDSDXXD-256G-GN4IN,SANDISK EXTREME PRO SDXC SDXXD 256GB V30 U3 C10 UHS-I 200MB/S R 140MB/S W 4X6 LIFETIME LIMITED,264.99,,140.86,140.86,140.86,Memory Card,30,,6.19659E+11,
SDSDXXD-512G-GN4IN,87078,SanDisk,SDSDXXD-512G-GN4IN,"SANDISK EXTREME PRO SDXC, SDXXD 512GB, V30, U3, C10, UHS-I, 200MB/S R, 140MB/S W, 4X6, LIFETIME LIMITED",555.99,,250.43,250.43,250.43,Memory Card,8,,6.19659E+11,
SDSDXXO-032G-GN4IN,86911,SanDisk,SDSDXXO-032G-GN4IN,SANDISK EXTREME PRO SDHC SDXXO 32GB U3 C10 V30 UHS-I 100MB/S R 90MB/S W 4X6 LIFETIME LIMITED,46.99,,39.12,39.12,39.12,Memory Card,30,,,
SDSDXXU-064G-GN4IN,86912,SanDisk,SDSDXXU-064G-GN4IN,SANDISK EXTREME PRO SDXC SDXXU 64GB V30 U3 C10 UHS-I 200MB/S R 90MB/S W 4X6 LIFETIME LIMITED,69.99,26/07/2023,54.77,54.77,54.77,Memory Card,0,,,
SDSQQNR-032G-GN6IA,79531,SanDisk,SDSQQNR-032G-GN6IA,SANDISK HIGH ENDURANCE MICROSDHC CARD SQQNR 32G UHS-I C10 U3 V30 100MB/S R 40MB/S W,44.99,,31.3,31.3,31.3,Memory Card,30,,6.19659E+11,
SDSQQNR-064G-GN6IA,79532,SanDisk,SDSQQNR-064G-GN6IA,SANDISK HIGH ENDURANCE MICROSDXC CARD SQQNR 64G UHS-I C10 U3 V30 100MB/S R 40MB/S W,69.99,,48.69,48.69,48.69,Memory Card,30,,6.19659E+11,
SDSQQNR-128G-GN6IA,79533,SanDisk,SDSQQNR-128G-GN6IA,SANDISK HIGH ENDURANCE MICROSDXC CARD SQQNR 128G (10000 HRS) UHS-I C10 U3 V30 100MB/S R 40MB/S W SD ADAPTOR 2Y,109.99,,76.51,76.51,76.51,Memory Card,30,,6.19659E+11,
SDSQUA4-032G-GN6MA,83296,SanDisk,SDSQUA4-032G-GN6MA,SANDISK ULTRA MICROSDHC SQUA4 32GB A1 C10 U1 UHS-I 120MB/S R 4X6 SD ADAPTOR 10Y,21.99,,15.64,15.64,15.64,Memory Card,30,,,
SDSQUAB-064G-GN6MA,87173,SanDisk,SDSQUAB-064G-GN6MA,SANDISK ULTRA MICROSDHC SQUAB 64GB A1 C10 U1 UHS-I 140MB/S R 4X6 SD ADAPTOR 10Y,47.72,,23.47,23.47,23.47,Memory Card,30,,6.19659E+11,
SDSQUAB-128G-GN6MA,87174,SanDisk,SDSQUAB-128G-GN6MA,SANDISK ULTRA MICROSDHC SQUAB 128GB A1 C10 U1 UHS-I 140MB/S R 4X6 SD ADAPTOR 10Y,59.99,,39.12,39.12,39.12,Memory Card,30,,6.19659E+11,
SDSQUAC-1T00-GN6MA,87177,SanDisk,SDSQUAC-1T00-GN6MA,SANDISK ULTRA MICROSDXC SQUAC 1TB A1 C10 U1 UHS-I 150MB/S R 4X6 SD ADAPTOR 10Y,399.99,,289.56,289.56,289.56,Memory Card,30,,6.19659E+11,
SDSQUAC-256G-GN6MA,87175,SanDisk,SDSQUAC-256G-GN6MA,SANDISK ULTRA MICROSDXC SQUAC 256GB A1 C10 U1 UHS-I 150MB/S R 4X6 SD ADAPTOR 10Y,129.99,,78.25,78.25,78.25,Memory Card,8,,6.19659E+11,
SDSQXA1-512G-GN6MA,80125,SanDisk,SDSQXA1-512G-GN6MA,"SanDisk Extreme microSDXC, [SQXA1] 512GB, V30, U3, C10, A2, UHS-I, 160MB/s R, 90MB/s W, 4x6, SD adaptor, Lifetime Limited",599,,107.77,107.77,107.77,Memory Card,B,,SDSQXA1-512G-GN6MA,
SDSQXAA-128G-GN6MA,86901,SanDisk,SDSQXAA-128G-GN6MA,SANDISK EXTREME MICROSDXC SQXAA 128GB V30 U3 C10 A2 UHS-I 190MB/S R 90MB/S W 4X6 SD ADAPTOR LIFETIME LIMITED,93.99,,54.77,54.77,54.77,Memory Card,30,,6.19659E+11,
SDSQXAF-032G-GN6MA,77615,SanDisk,SDSQXAF-032G-GN6MA,SANDISK EXTREME MICROSDHC SQXAF 32GB V30 U3 C10 A1 UHS-1 100MB/S R 60MB/S W 4X6 SD ADAPTOR LIFETIME LIMITED,29.99,,27.82,27.82,27.82,Memory Card,30,,6.19659E+11,
SDSQXAH-064G-GN6MA,86900,SanDisk,SDSQXAH-064G-GN6MA,SANDISK EXTREME MICROSDXC SQXAH 64GB V30 U3 C10 A2 UHS-I 170MB/S R 80MB/S W 4X6 SD ADAPTOR LIFETIME LIMITED,51.99,,31.3,31.3,31.3,Memory Card,30,,,
SDSQXAV-1T00-GN6MA,87074,SanDisk,SDSQXAV-1T00-GN6MA,"SANDISK EXTREME MICROSDXC, SQXAV 1TB, V30, U3, C10, A2, UHS-I, 190MB/S R, 130MB/S W, 4X6, SD ADAPTOR, LIFETIME LIMITED",422.6,,352.17,352.17,352.17,Memory Card,17,,6.19659E+11,
SDSQXAV-256G-GN6MA,86902,SanDisk,SDSQXAV-256G-GN6MA,SANDISK EXTREME MICROSDXC SQXAV 256GB V30 U3 C10 A2 UHS-I 190MB/S R 130MB/S W 4X6 SD ADAPTOR LIFETIME LIMITED,139.99,,109.56,109.56,109.56,Memory Card,30,,,
SDSQXAV-512G-GN6MA,86903,SanDisk,SDSQXAV-512G-GN6MA,SANDISK EXTREME MICROSDXC SQXAV 512GB V30 U3 C10 A2 UHS-I 190MB/S R 130MB/S W 4X6 SD ADAPTOR LIFETIME LIMITED,249.99,TBC,195.64,195.64,195.64,Memory Card,0,,6.19659E+11,
SDSQXCD-128G-GN6MA,86905,SanDisk,SDSQXCD-128G-GN6MA,SANDISK EXTREME PRO MICROSDXC SQXCD 128GB V30 U3 C10 A2 UHS-I 200MB/S R 90MB/S W 4X6 SD ADAPTOR LIFETIME LIMITED,96.99,19/07/2023,62.6,62.6,62.6,Memory Card,0,,,
SDSQXCD-1T00-GN6MA,87075,SanDisk,SDSQXCD-1T00-GN6MA,"SANDISK EXTREME PRO MICROSDXC, SQXCD 1TB, V30, U3, C10, A2, UHS-I, 200MB/S R, 140MB/S W, 4X6, SD ADAPTOR, LIFETIME LIMITED",469.56,19/07/2023,391.3,391.3,391.3,Memory Card,0,,6.19659E+11,
SDSQXCD-256G-GN6MA,86906,SanDisk,SDSQXCD-256G-GN6MA,SANDISK EXTREME PRO MICROSDXC SQXCD 256GB V30 U3 C10 A2 UHS-I 200MB/S R 140MB/S W 4X6 SD ADAPTOR LIFETIME LIMITED,176.99,,117.38,117.38,117.38,Memory Card,30,,,
SDSQXCD-512G-GN6MA,86907,SanDisk,SDSQXCD-512G-GN6MA,SANDISK EXTREME PRO MICROSDXC SQXCD 512GB V30 U3 C10 A2 UHS-I 200MB/S R 140MB/S W 4X6 SD ADAPTOR LIFETIME LIMITED,269.99,,211.3,211.3,211.3,Memory Card,30,,,
SDSQXCG-032G-GN6MA,77350,SanDisk,SDSQXCG-032G-GN6MA,SANDISK EXTREME PRO MICROSDHC SQXCG 32GB V30 U3 C10 A1 UHS-1 100MB/S R 90MB/S W 4X6 SD ADAPTOR LIFETIME LIMITED,39.99,,31.3,31.3,31.3,Memory Card,30,,6.19659E+11,
SDSQXCU-064G-GN6MA,86904,SanDisk,SDSQXCU-064G-GN6MA,SANDISK EXTREME PRO MICROSDXC SQXCU 64GB V30 U3 C10 A2 UHS-I 200MB/S R 90MB/S W 4X6 SD ADAPTOR LIFETIME LIMITED,52.99,,39.12,39.12,39.12,Memory Card,30,,,
SDSSDE61-1T00-G25,85033,SanDisk,SDSSDE61-1T00-G25,SANDISK EXTREME PORTABLE SSD SDSSDE61 1TB USB 3.2 GEN 2 1050MB/S R 1000MB/S W IP55 DUS 5Y,312.12,19/07/2023,244.27,244.27,244.27,SSD Hard Drive - External,0,6.19659E+11,6.19659E+11,
SDSSDE61-2T00-G25,85034,SanDisk,SDSSDE61-2T00-G25,SANDISK EXTREME PORTABLE SSD SDSSDE61 2TB USB 3.2 GEN 2 1050MB/S R 1000MB/S W IP55 DUS 5Y,569.3,16/08/2023,445.54,445.54,445.54,SSD Hard Drive - External,0,6.19659E+11,6.19659E+11,
SDSSDE61-4T00-G25,87932,SanDisk,SDSSDE61-4T00-G25,SANDISK EXTREME PORTABLE SSD SDSSDE61 4TB USB 3.2 GEN 2 1050MB/S R 1000MB/S W IP55 DUS 5Y,1137.8,,890.46,890.46,890.46,SSD Hard Drive - External,15,,6.19659E+11,
SDSSDE81-2T00-G25,84891,SanDisk,SDSSDE81-2T00-G25,SANDISK EXTREME PRO PORTABLE SSD 2TB USB3.2 GEN 2X2 2000MB/S R 1900MB/S W IPS5 5Y,812.95,,636.22,636.22,636.22,SSD Hard Drive - External,10,6.19659E+11,,
SDSSDE81-4T00-G25,86363,SanDisk,SDSSDE81-4T00-G25,SANDISK EXTREME PRO PORTABLE SSD SDSSDE81 4TB 2000MB/S R 1900MB/S W IP55 5Y,1570.95,,1229.44,1229.44,1229.44,SSD Hard Drive - External,28,6.19659E+11,,
SFG14-41-R1HK(NX.KG3SA.005),88605,Acer,NX.KG3SA.005-RW0,"ACER SWIFT GO SFG14-41-R1HK 14"" FHD AMD RYZEN7 7730U 16GB 512GB SSD WIN11 NOTEBOOK 1YR WTY",1749,,1326,1326,1326,Notebook - Consumer,8,,,
SHD_TV_PRO,81719,Nvidia,945-12897-2506-101,NVIDIA SHIELD TV PRO STREAMING MEDIA PLAYER WITH REMOTE,459,,368,368,368,Game Console,30,,,
SHIELD_TV,81717,Nvidia,945-13430-2512-000,NEW NVIDIA SHIELD TV STREAMING MEDIA PLAYER WITH REMOTE,329,,286,286,286,Game Console,28,,,
